{
  "schema": 2,
  "onsager_tc": 2.269185,
  "source": "windowsill-lab",
  "generated_from": "reports/receipts/run-2026-09-09-0300-m01.json",
  "provenance": {
    "dependencies": {
      "matplotlib": "3.11.1",
      "numpy": "2.5.1",
      "torch": "2.10.0.dev20251031+rocm6.4"
    },
    "platform": "linux-x86_64",
    "python": "3.14.4",
    "source_clean": true,
    "source_commit": "0fcd52bf98c2c1bf5a4d36b446f638d384641e21",
    "source_diff_sha256": null,
    "source_tree_sha256": "3562986be5485fd2ebc9621db350230f51baf600104c85d265e7fffbb69f9698"
  },
  "m01": {
    "source_report": "reports/receipts/run-2026-09-09-0300-m01.json",
    "date": "2026-09-09",
    "config": {
      "L": 128,
      "seed": 1215,
      "device": "cuda",
      "n_sweeps": 40000,
      "n_burnin": 8000,
      "n_temps": 21
    },
    "wall_seconds": 20.994681358337402,
    "T": [
      1.5,
      1.6,
      1.7,
      1.8,
      1.9,
      2.0,
      2.1,
      2.2,
      2.3,
      2.4,
      2.5,
      2.6,
      2.7,
      2.8,
      2.9,
      3.0,
      3.1,
      3.2,
      3.3,
      3.4,
      3.5
    ],
    "chi_peak_t": 2.3,
    "raw_chi_peak_t": 2.3,
    "quality_status": "ok",
    "quality_note": "all susceptibility samples passed the equilibrium guard",
    "excluded_indices": [],
    "valid_indices": [
      0,
      1,
      2,
      3,
      4,
      5,
      6,
      7,
      8,
      9,
      10,
      11,
      12,
      13,
      14,
      15,
      16,
      17,
      18,
      19,
      20
    ],
    "abs_mag": [
      0.9864819049835205,
      0.9796088933944702,
      0.9701299667358398,
      0.9568150043487549,
      0.9385156631469727,
      0.9112234711647034,
      0.869118869304657,
      0.7842534184455872,
      0.2664508521556854,
      0.0772019624710083,
      0.05000317469239235,
      0.03817925974726677,
      0.030568420886993408,
      0.026617737486958504,
      0.022933289408683777,
      0.02068328857421875,
      0.019883545115590096,
      0.01848309300839901,
      0.017121948301792145,
      0.016314269974827766,
      0.015341918915510178
    ],
    "abs_mag_err": [
      3.5339955502422526e-05,
      4.487484693527222e-05,
      5.86837631999515e-05,
      7.937725604278967e-05,
      0.000104456179542467,
      0.00015586121298838407,
      0.00024205025692936033,
      0.0006219621864147484,
      0.0035144533030688763,
      0.0012908815406262875,
      0.0008495023939758539,
      0.0006308596930466592,
      0.0005089811165817082,
      0.0004490278661251068,
      0.00038907499401830137,
      0.0003551181289367378,
      0.00032307146466337144,
      0.0003170546842738986,
      0.0002890737378038466,
      0.00027803611010313034,
      0.0002555407991167158
    ],
    "chi": [
      0.02864583395421505,
      0.04150390625,
      0.06548713147640228,
      0.1139322966337204,
      0.18863075971603394,
      0.39697265625,
      0.9133185148239136,
      5.75861120223999,
      524.8781127929688,
      62.73427200317383,
      25.839763641357422,
      14.174408912658691,
      8.808867454528809,
      6.502972602844238,
      4.679902076721191,
      3.71199893951416,
      3.190824031829834,
      2.77533221244812,
      2.2810840606689453,
      2.024862051010132,
      1.7110340595245361
    ],
    "chi_abs": [
      0.02864583395421505,
      0.04150390625,
      0.06548713147640228,
      0.1139322966337204,
      0.18863075971603394,
      0.39697265625,
      0.9133185148239136,
      5.75861120223999,
      175.88172912597656,
      22.740198135375977,
      9.454137802124023,
      5.013314247131348,
      3.1424779891967773,
      2.3584206104278564,
      1.7096272706985474,
      1.3767563104629517,
      1.1027272939682007,
      1.0288476943969727,
      0.8293467164039612,
      0.7446568012237549,
      0.6110618710517883
    ],
    "energy": [
      -1.9510324001312256,
      -1.9281642436981201,
      -1.8983274698257446,
      -1.8591827154159546,
      -1.8099719285964966,
      -1.7453961372375488,
      -1.6623899936676025,
      -1.5462701320648193,
      -1.3450889587402344,
      -1.2047151327133179,
      -1.1057924032211304,
      -1.0281007289886475,
      -0.9630434513092041,
      -0.9086055755615234,
      -0.8597287535667419,
      -0.8172158002853394,
      -0.7789486050605774,
      -0.745627224445343,
      -0.7145970463752747,
      -0.6852881908416748,
      -0.660061776638031
    ],
    "specific_heat": [
      0.19632112979888916,
      0.24983716011047363,
      0.3232974410057068,
      0.442556232213974,
      0.5412958860397339,
      0.7504578232765198,
      0.9811226725578308,
      1.433903455734253,
      2.042969226837158,
      1.0940823554992676,
      0.8255719542503357,
      0.7245966792106628,
      0.5964247584342957,
      0.49955108761787415,
      0.44937771558761597,
      0.3974018096923828,
      0.3383062183856964,
      0.31614118814468384,
      0.2856256663799286,
      0.27393296360969543,
      0.2397090345621109
    ],
    "snapshots": {
      "1.5": "/9/////////////////////////////////////////////////////////////////////////////////////+//////////H/////f//////////////////////////////////z/////////////v//////////////////////////////////////////////////////////3////////////////////////5///////////////////38b////////////////////f/////+/9///////////////////////////////////////////////////////////////////////////////////////////////////////////////////////////////9///////7//////////////////////////////////////////////////9///////////////////5////////////////////9////////////////////9///////////////////////////////////f////////////////////////////////////n/f/+/////////////////////////93//////////////////9//////////////////////////v////5////////////////////////////////7/////////////////u7//////////////8////7///////////////////////////////////////////////3///////////////////////9/////////9///////////P///////////////////////////////////////3/////////////+/////////////////////////////////f/////////////////////////////////////////////////////////////v////3/////////////////////////////////////////////////////////8f////////////////////D////////////////////X//f/7+/////9///////////3////////////////////////////////////////////////////////////////+//////v/////////////////+/////7//7//////79////////////////+////f///////////////////////////////7/////////////7///9//3/////////v/////////////////////////////////////////3/////////////////////////////////////////////////9///////////////3///////////////////////////////////////////3///////////////3////////////////////////v////7/////v///////////////////////////////////////////////+/////////////////////v//7/7///////////////7/////////////////////////////////////////f///////////////////////////////v///////////////////////////////////////////////////////9//////////////////////////////+//////////////////////////3//////////////////////////////////////3////////////////////////////////////////////////////////////////////////////4/////////////////////P////////7///////////7//7////////////////////+///////////////////////////////////////////////////////////////f/3/////////////9/f3//////////////////////3////////////////////////////////////////////////////f//////7//////////////////////////////////////////////+//////////////////+//////+f///////////////////////////////////////////////z/////////////////////////+///////////f////////////////////////////+/////////////////73/////////////////////////////////////////3////////////////////9///f////////3/////////////////v////////////3//////////3/////////////////////////////////////////////////////f////////////////////////////+///////////v/////////////////9///////////////////////////////////////////////////////9//////v///////////////////////////////////////////////////////////f/////8=",